{
  "epics": [
    {
      "title": "ATS Phase 1 MVP Discovery",
      "features": [
        {
          "id": "FEAT-001",
          "items": [
            {
              "id": "TBI-001",
              "type": "TBI",
              "title": "Author the ATS discovery Skill definition and interview flow",
              "priority": "Must Have",
              "dependsOn": [],
              "description": "Write the standalone ATS discovery Skill so it plugs into the existing guided-interview flow. It opens with leadership's vision, asks one question per reply, covers each stage of the staffing lifecycle, uses research only to test decisions, and narrows Phase 1 to the smallest usable end-to-end workflow. Unanswered topics are recorded as unresolved, not skipped silently.",
              "parallelGroup": null,
              "definitionOfDone": [
                "Skill document exists, follows the repository's Skill format, and is selectable as an interview Skill option",
                "Skill opens with leadership's vision before any market research",
                "Skill lists every staffing lifecycle area and requires each to be covered or labeled unresolved",
                "Skill states the rule that Phase 1 is the smallest usable end-to-end workflow and everything else is deferred",
                "A scripted session confirms the Skill asks one question per reply"
              ],
              "technicalDependencies": [
                "Existing guided-interview flow loads the Skill selected in project skill settings",
                "ATS ADR (research-grounded-ats-discovery-skill) supplies the lifecycle areas and scope decisions"
              ],
              "nonFunctionalRequirements": [
                "Skill must work with the existing interview streaming and thread persistence without runtime changes",
                "Each reply asks exactly one question"
              ]
            },
            {
              "id": "TBI-002",
              "type": "TBI",
              "title": "Define decision ledger rules and conflict handling",
              "priority": "Must Have",
              "dependsOn": [
                "TBI-001"
              ],
              "description": "Add the ledger section to the Skill. It defines the four decision states, requires each reply to show the current ledger, requires the interview to pause on a conflict until the leader names the authoritative decision, and requires the final ledger to be written into the standard interview transcript. The ledger uses reply text and existing persistence only.",
              "parallelGroup": "rules-authoring",
              "definitionOfDone": [
                "Skill defines confirmed, assumed, unresolved, and superseded with one example each",
                "Skill requires a visible ledger update in each reply that changes a decision",
                "Skill requires a pause and a question when two decisions conflict",
                "Skill requires the final ledger in the transcript used for PRD generation",
                "Scripted sessions cover confirm, assume, skip, supersede, and conflict cases"
              ],
              "technicalDependencies": [
                "Existing chat thread and interview transcript persistence hold the ledger text",
                "TBI-001 interview flow defines where a ledger update appears in a reply"
              ],
              "nonFunctionalRequirements": [
                "Ledger must survive thread resume with no loss of state",
                "Ledger must stay short enough to show in every reply"
              ]
            },
            {
              "id": "TBI-003",
              "type": "TBI",
              "title": "Define research, source, and redaction rules",
              "priority": "Must Have",
              "dependsOn": [
                "TBI-001"
              ],
              "description": "Add the research section to the Skill. It sets when research is allowed, lists the identifier types to redact before any query, defines acceptable sources, requires source and date on every recorded claim, requires citations on claims that influence scope, and requires corroboration for material claims. It includes a short benchmark seed list for the product owner to review during the pilot.",
              "parallelGroup": "rules-authoring",
              "definitionOfDone": [
                "Skill lists the identifier types to redact and the step that redacts them before each query",
                "Skill defines source rules and requires source and date for every recorded claim",
                "Skill defines material claim and corroboration in the terms of the PRD",
                "Skill includes a benchmark seed list marked for review during the pilot",
                "Seeded test inputs with identifiers produce research queries with no leaked identifiers"
              ],
              "technicalDependencies": [
                "Project-configured web research access is enabled for the pilot project",
                "TBI-001 interview flow defines when a decision is ready to test"
              ],
              "nonFunctionalRequirements": [
                "Research queries must contain no personal, client, commercial, or internal identifiers",
                "Research must not leave a reply without visible status"
              ]
            },
            {
              "id": "TBI-004",
              "type": "TBI",
              "title": "Define completion rubric and PRD-ready output contract",
              "priority": "Must Have",
              "dependsOn": [
                "TBI-002",
                "TBI-003"
              ],
              "description": "Add the completion section to the Skill. It states when a session may finish, requires a Phase 1 brief, deferred roadmap, and research notes in the interview transcript in a form PRD generation reads, and keeps incomplete sessions as drafts.",
              "parallelGroup": null,
              "definitionOfDone": [
                "Skill states the completion checks: coverage or unresolved labels, no open conflict, citations and corroboration present",
                "Skill defines the structure of the Phase 1 brief, deferred roadmap, and research notes",
                "Skill states that an incomplete session remains a draft",
                "A finished test transcript is accepted by PRD generation and yields a usable PRD"
              ],
              "technicalDependencies": [
                "PRD generation reads the finished interview transcript",
                "Decision ledger and research rules from TBI-002 and TBI-003"
              ],
              "nonFunctionalRequirements": [
                "Output must be readable by PRD generation without manual rewriting",
                "Deferred scope must be kept apart from Phase 1 scope"
              ]
            },
            {
              "id": "TBI-005",
              "type": "TBI",
              "title": "Configure the pilot project and fallback",
              "priority": "Must Have",
              "dependsOn": [
                "TBI-004"
              ],
              "description": "Write the pilot runbook and the configuration values for one project: register the ATS discovery Skill as an interview Skill option in project skill settings, enable web research and set the model, and confirm the existing interview Skill still starts. Describe how to remove the option.",
              "parallelGroup": null,
              "definitionOfDone": [
                "Runbook names the settings to change and the values to use for the pilot project",
                "ATS discovery Skill appears as an interview option only in the pilot project",
                "Existing interview Skill still starts in the pilot project",
                "Runbook describes how a Project Admin removes the option"
              ],
              "technicalDependencies": [
                "Existing project skill settings support interview Skill options, web research, and model selection per project",
                "Completed Skill from TBI-001 through TBI-004"
              ],
              "nonFunctionalRequirements": [
                "Configuration must affect only the pilot project",
                "Removing the option must leave in-progress threads readable"
              ]
            },
            {
              "id": "TBI-006",
              "type": "TBI",
              "title": "Define pilot scenarios and acceptance checklist",
              "priority": "Must Have",
              "dependsOn": [
                "TBI-004"
              ],
              "description": "Write the pilot scenarios and a checklist that maps each pass condition to an observable check: lifecycle coverage, decision retention, citations, corroboration, resume, permissions, and Product-Owner acceptance. Record where results are kept and what counts as a runtime gap.",
              "parallelGroup": null,
              "definitionOfDone": [
                "Checklist has one observable check per pass condition",
                "Scenarios cover a normal run, a conflict, a resume after a break, and a run with seeded identifiers",
                "Checklist includes a permission check for view-only users",
                "Document states which findings count as a runtime gap needing a separate PRD"
              ],
              "technicalDependencies": [
                "Completion rubric from TBI-004",
                "Existing interview resume and permission behavior"
              ],
              "nonFunctionalRequirements": [
                "Checklist must use pass or fail checks with no numeric score",
                "Scenarios must run without production client data"
              ]
            },
            {
              "id": "PBI-001",
              "type": "PBI",
              "title": "Shape a Phase 1 MVP through a guided leadership interview",